{
  "dossier_id": "INTAKE-1776110504668",
  "country": "Uganda",
  "submission_date": "2026-04-13",
  "product": {
    "product_name": "incoming deep review incomplete evidence",
    "inn_name": "Not provided",
    "atc_code": "unknown",
    "dosage_form": "unknown",
    "strength": "unknown"
  },
  "organization": {
    "applicant": "Not provided",
    "manufacturer": "Not provided",
    "facility_country": "Uganda"
  },
  "policy_signals": {
    "inn_infringement": false,
    "gmp_inspection_status": "non_compliant",
    "gmp_inspection_recent": true,
    "gmp_certificate_validity": "valid",
    "clinical_data_available": true,
    "pivotal_trial_outcome": "inconclusive",
    "aware_category": "not_applicable",
    "amr_unmet_need": "not_applicable",
    "targets_mdr_pathogen": false,
    "glass_resistance_trend": "not_applicable",
    "similarity_to_existing_watch": "not_applicable",
    "existing_watch_comparator": "not_applicable"
  },
  "sections": [
    {
      "section_id": "m1_gmp",
      "module": "1",
      "title": "Manufacturer and GMP Evidence",
      "text": "GMP certificate remains valid and no critical findings were reported.",
      "critical": true,
      "constraints": {
        "min_chars": 50,
        "max_chars": 12000
      },
      "labels": {
        "presence": "present",
        "length_status": "length_ok",
        "correctness": "correct",
        "error_tags": []
      },
      "metrics": {
        "char_count": 69
      }
    },
    {
      "section_id": "m2_clinical_overview",
      "module": "2",
      "title": "Clinical Overview and Benefit-Risk Summary",
      "text": "Results were inconclusive and additional confirmatory analysis is pending.",
      "critical": true,
      "constraints": {
        "min_chars": 50,
        "max_chars": 12000
      },
      "labels": {
        "presence": "present",
        "length_status": "length_ok",
        "correctness": "correct",
        "error_tags": []
      },
      "metrics": {
        "char_count": 74
      }
    },
    {
      "section_id": "m2_quality_overall_summary",
      "module": "2",
      "title": "Quality Overall Summary",
      "text": "Quality package is present, but some supportive justifications require reviewer follow-up.",
      "critical": true,
      "constraints": {
        "min_chars": 50,
        "max_chars": 12000
      },
      "labels": {
        "presence": "present",
        "length_status": "length_ok",
        "correctness": "correct",
        "error_tags": []
      },
      "metrics": {
        "char_count": 90
      }
    }
  ],
  "labels": {
    "holistic_policy_decision": "standard_review",
    "risk_score": 0.5,
    "compliant_submission": true
  },
  "provenance": {
    "synthetic": false,
    "defect_modes": [],
    "ingestion_mode": "raw_file_intake",
    "source_filename": "incoming_deep_review_incomplete_evidence.pdf",
    "extraction": {
      "extraction_method": "pdf_text_layer",
      "page_count": 1,
      "image_count": 0,
      "ocr_used": false,
      "warnings": []
    }
  }
}