{
  "dossier_id": "INTAKE-1776114546088",
  "country": "Uganda",
  "submission_date": "2026-04-13",
  "product": {
    "product_name": "incoming standard review submission",
    "inn_name": "Not provided",
    "atc_code": "unknown",
    "dosage_form": "unknown",
    "strength": "unknown"
  },
  "organization": {
    "applicant": "Not provided",
    "manufacturer": "Not provided",
    "facility_country": "Uganda"
  },
  "policy_signals": {
    "inn_infringement": false,
    "gmp_inspection_status": "compliant",
    "gmp_inspection_recent": true,
    "gmp_certificate_validity": "valid",
    "clinical_data_available": true,
    "pivotal_trial_outcome": "endpoint_met",
    "aware_category": "not_applicable",
    "amr_unmet_need": "not_applicable",
    "targets_mdr_pathogen": false,
    "glass_resistance_trend": "not_applicable",
    "similarity_to_existing_watch": "not_applicable",
    "existing_watch_comparator": "not_applicable"
  },
  "sections": [
    {
      "section_id": "raw_section_1",
      "module": "raw",
      "title": "Imported Section 1",
      "text": "Application Cover Letter\n\nStandard quality submission for routine pre-market review.",
      "critical": false,
      "constraints": {
        "min_chars": 50,
        "max_chars": 12000
      },
      "labels": {
        "presence": "present",
        "length_status": "length_ok",
        "correctness": "correct",
        "error_tags": []
      },
      "metrics": {
        "char_count": 84
      }
    },
    {
      "section_id": "m1_gmp",
      "module": "1",
      "title": "Manufacturer and GMP Evidence",
      "text": "GMP certificate remains valid and no critical findings were reported during the latest inspection.",
      "critical": true,
      "constraints": {
        "min_chars": 50,
        "max_chars": 12000
      },
      "labels": {
        "presence": "present",
        "length_status": "length_ok",
        "correctness": "correct",
        "error_tags": []
      },
      "metrics": {
        "char_count": 98
      }
    },
    {
      "section_id": "m2_quality_overall_summary",
      "module": "2",
      "title": "Quality Overall Summary",
      "text": "Control strategy, stability summary, and batch consistency data are complete.",
      "critical": true,
      "constraints": {
        "min_chars": 50,
        "max_chars": 12000
      },
      "labels": {
        "presence": "present",
        "length_status": "length_ok",
        "correctness": "correct",
        "error_tags": []
      },
      "metrics": {
        "char_count": 77
      }
    },
    {
      "section_id": "m2_clinical_overview",
      "module": "2",
      "title": "Clinical Overview and Benefit-Risk Summary",
      "text": "Primary endpoint was met in the pivotal study and the benefit-risk profile is acceptable.",
      "critical": true,
      "constraints": {
        "min_chars": 50,
        "max_chars": 12000
      },
      "labels": {
        "presence": "present",
        "length_status": "length_ok",
        "correctness": "correct",
        "error_tags": []
      },
      "metrics": {
        "char_count": 89
      }
    },
    {
      "section_id": "m1_product_information",
      "module": "1",
      "title": "Product Information and Naming",
      "text": "Product name differentiation review did not identify a naming conflict.",
      "critical": true,
      "constraints": {
        "min_chars": 50,
        "max_chars": 12000
      },
      "labels": {
        "presence": "present",
        "length_status": "length_ok",
        "correctness": "correct",
        "error_tags": []
      },
      "metrics": {
        "char_count": 71
      }
    }
  ],
  "labels": {
    "holistic_policy_decision": "standard_review",
    "risk_score": 0.11,
    "compliant_submission": true
  },
  "provenance": {
    "synthetic": false,
    "defect_modes": [],
    "ingestion_mode": "raw_file_intake",
    "source_filename": "incoming_standard_review_submission.pdf",
    "extraction": {
      "extraction_method": "pdf_text_layer",
      "page_count": 1,
      "image_count": 0,
      "ocr_used": false,
      "warnings": [],
      "visual_evidence": []
    }
  }
}