{
  "dossier_id": "INTAKE-1776029205573",
  "country": "Uganda",
  "submission_date": "2026-04-12",
  "product": {
    "product_name": "Incoming",
    "inn_name": "unknown",
    "atc_code": "unknown",
    "dosage_form": "unknown",
    "strength": "unknown"
  },
  "organization": {
    "applicant": "Unknown",
    "manufacturer": "Unknown",
    "facility_country": "Unknown"
  },
  "policy_signals": {
    "inn_infringement": false,
    "gmp_inspection_status": "compliant",
    "gmp_inspection_recent": true,
    "gmp_certificate_validity": "valid",
    "clinical_data_available": true,
    "pivotal_trial_outcome": "endpoint_met",
    "aware_category": "not_applicable",
    "amr_unmet_need": "not_applicable",
    "targets_mdr_pathogen": false,
    "glass_resistance_trend": "not_applicable",
    "similarity_to_existing_watch": "not_applicable",
    "existing_watch_comparator": "not_applicable"
  },
  "sections": [
    {
      "section_id": "raw_section_1",
      "module": "raw",
      "title": "Imported Section 1",
      "text": "Incoming PDFSemple 2\nManufacturerand GMP Evidence\nThe manufacturing site passed inspectionand no criticalfindings were reported.\nClinical Overview and Benefi-Risk Summary\nEndpoint metand benefit-risk remains favorable for standard review.\nAMRStewardship Narrative\nNoexce ptional stewardship controls were requested.",
      "critical": false,
      "constraints": {
        "min_chars": 50,
        "max_chars": 12000
      },
      "labels": {
        "presence": "present",
        "length_status": "length_ok",
        "correctness": "correct",
        "error_tags": []
      },
      "metrics": {
        "char_count": 315
      }
    }
  ],
  "labels": {
    "holistic_policy_decision": "standard_review",
    "risk_score": 0.5,
    "compliant_submission": true
  },
  "provenance": {
    "synthetic": false,
    "defect_modes": [],
    "ingestion_mode": "raw_file_intake",
    "source_filename": "incoming_standard_review_submission.pdf",
    "extraction": {
      "extraction_method": "pdf_ocr",
      "page_count": 1,
      "image_count": 1,
      "ocr_used": true,
      "warnings": [
        "ocr_fallback_used"
      ]
    }
  }
}